{
  "contract": "capability-manifest",
  "contract_version": 1,
  "manifest_id": "66666666-7777-4777-8888-999999999999",
  "connection_id": "11111111-2222-4333-8444-555555555555",
  "app_id": "123456789012345678",
  "guild_id": "223456789012345678",
  "generation": 7,
  "key_id": "relay-current-2026-01",
  "issued_at": "2026-08-08T12:00:00Z",
  "expires_at": "2026-08-09T00:00:00Z",
  "capabilities": [
    "discord.capabilities",
    "discord.delivery",
    "discord.interactions"
  ],
  "routes": [
    {
      "route_id": "capabilities.read",
      "method": "GET",
      "path": "/api/v1/discord/capabilities",
      "capability": "discord.capabilities"
    },
    {
      "route_id": "delivery.receipt",
      "method": "POST",
      "path": "/api/v1/discord/delivery/receipts",
      "capability": "discord.delivery"
    }
  ],
  "limits": {
    "max_batch_items": 100,
    "max_delivery_bytes": 16384,
    "max_proof_bytes": 65536,
    "max_receipt_bytes": 262144,
    "max_clock_skew_seconds": 60,
    "max_lease_seconds": 300,
    "dedupe_window_seconds": 86400
  },
  "keys": {
    "current": {
      "key_id": "relay-current-2026-01",
      "algorithm": "ed25519",
      "public_key": "A6EHv_POEL4dcN0Y50vAmWfk1jCbpQ1fHdyGZBJVMbg",
      "activated_at": "2026-08-01T00:00:00Z"
    },
    "next": null
  },
  "signature": {
    "algorithm": "ed25519",
    "value": "19eff62dfb9dba4db2ae02332de25f84ab3d1478bbc42bf67194cf163f3a1a912b51adcb7ce8574f6566d762f4cf6308626e7bcac82de476896ab91ba1e43f03"
  }
}
